{
  "totalDeductionAmount": 12345.56,
  "totalCostOfMaterials": 234234.33,
  "totalGrossAmountPaid": 2342424.56,
  "cisDeductions" : [
    {
      "fromDate": "2020-04-06",
      "toDate": "2021-04-05",
      "contractorName": "contractor Name",
      "employerRef": "123/AA12345",
      "totalDeductionAmount": 3543.55,
      "totalCostOfMaterials": 6644.67,
      "totalGrossAmountPaid": 3424.12,
      "periodData": [
        {
          "deductionFromDate": "2020-04-06",
          "deductionToDate": "2020-05-05",
          "deductionAmount": 4654.78,
          "costOfMaterials": 4564.89,
          "grossAmountPaid": 7878.67,
          "submissionDate": "2020-05-11T16:38:57Z",
          "submissionId": "4557ecb5-fd32-48cc-81f5-e6acd1099f3c",
          "source": "customer"
        },
        {
          "deductionFromDate": "2020-05-06",
          "deductionToDate": "2020-06-05",
          "deductionAmount": 355.00,
          "costOfMaterials": 35.00,
          "grossAmountPaid": 1457.00,
          "submissionDate": "2020-05-11T16:38:57Z",
          "source": "contractor"
        }
      ]
    },
    {
      "fromDate": "2020-04-06",
      "toDate": "2021-04-05",
      "contractorName": "Soylent Solutions",
      "employerRef": "123/TW44355",
      "totalDeductionAmount": 3543.55,
      "totalCostOfMaterials": 6644.67,
      "totalGrossAmountPaid": 3424.12,
      "periodData": [
        {
          "deductionFromDate": "2020-07-06",
          "deductionToDate": "2020-08-05",
          "deductionAmount": 60.00,
          "costOfMaterials": 35.00,
          "grossAmountPaid": 1457.00,
          "submissionDate": "2020-05-11T16:38:57Z",
          "source": "contractor"
        },
        {
          "deductionFromDate": "2020-09-06",
          "deductionToDate": "2020-10-05",
          "deductionAmount": 60.00,
          "costOfMaterials": 35.00,
          "grossAmountPaid": 1457.00,
          "submissionDate": "2020-05-11T16:38:57Z",
          "source": "contractor"
        }
      ]
    }
  ]
}
